{
  "name": "input-otp",
  "description": "One-time code input whose root owns the code.",
  "files": [
    {
      "source": "templates/input_otp.rs",
      "target": "src/components/ui/input_otp.rs"
    }
  ],
  "dependencies": [
    "element-id",
    "root-state",
    "utils"
  ],
  "assets": []
}
