{
  "name": "combobox",
  "description": "Controlled searchable selection parts backed by popover primitive configuration.",
  "files": [
    {
      "source": "templates/combobox.rs",
      "target": "src/components/ui/combobox.rs"
    }
  ],
  "dependencies": [
    "anchored-overlay",
    "default-attribute",
    "listbox",
    "overlay",
    "utils"
  ],
  "assets": []
}
