{
  "name": "sonner",
  "description": "Opinionated toast notification parts and queue helpers.",
  "files": [
    {
      "source": "templates/sonner.rs",
      "target": "src/components/ui/sonner.rs"
    }
  ],
  "dependencies": [
    "density",
    "dismiss-timer",
    "utils"
  ],
  "assets": []
}
