{
  "name": "select",
  "description": "Select components backed by primitive configuration types.",
  "files": [
    {
      "source": "templates/select.rs",
      "target": "src/components/ui/select.rs"
    }
  ],
  "dependencies": [
    "anchored-overlay",
    "choice",
    "default-attribute",
    "density",
    "element-id",
    "listbox",
    "overlay",
    "root-state",
    "utils"
  ],
  "assets": []
}
