{
  "name": "toggle-group",
  "description": "Toggle Group whose root owns the pressed item, or items.",
  "files": [
    {
      "source": "templates/toggle_group.rs",
      "target": "src/components/ui/toggle_group.rs"
    }
  ],
  "dependencies": [
    "choice",
    "roving-group",
    "root-state",
    "utils"
  ],
  "assets": []
}
