{
  "name": "sheet",
  "description": "Side sheet overlay components backed by dialog primitive configuration.",
  "files": [
    {
      "source": "templates/sheet.rs",
      "target": "src/components/ui/sheet.rs"
    }
  ],
  "dependencies": [
    "default-attribute",
    "density",
    "dialog-labels",
    "layer",
    "modal-focus",
    "overlay",
    "overlay-root",
    "root-state",
    "utils"
  ],
  "assets": []
}
