{
  "name": "dialog",
  "description": "Dialog overlay components backed by primitive configuration types.",
  "files": [
    {
      "source": "templates/dialog.rs",
      "target": "src/components/ui/dialog.rs"
    }
  ],
  "dependencies": [
    "default-attribute",
    "dialog-labels",
    "modal-focus",
    "overlay",
    "overlay-root",
    "root-state",
    "utils"
  ],
  "assets": []
}
