{
  "name": "command",
  "description": "Command list whose root links the input to the list and highlights options.",
  "files": [
    {
      "source": "templates/command.rs",
      "target": "src/components/ui/command.rs"
    }
  ],
  "dependencies": [
    "element-id",
    "listbox",
    "root-state",
    "utils"
  ],
  "assets": []
}
