{
  "name": "sidebar",
  "description": "Controlled sidebar shell and navigation composition parts.",
  "files": [
    {
      "source": "templates/sidebar.rs",
      "target": "src/components/ui/sidebar.rs"
    }
  ],
  "dependencies": [
    "default-attribute",
    "media-query",
    "modal-focus",
    "utils"
  ],
  "assets": []
}
