{
  "name": "hover-card",
  "description": "Controlled rich preview content backed by popover primitive configuration.",
  "files": [
    {
      "source": "templates/hover_card.rs",
      "target": "src/components/ui/hover_card.rs"
    }
  ],
  "dependencies": [
    "anchored-overlay",
    "hover-open",
    "overlay",
    "utils"
  ],
  "assets": []
}
