{
  "name": "choice",
  "description": "The value, or values, a Select, Combobox, Accordion, or Toggle Group root owns (RFC 0077).",
  "files": [
    {
      "source": "templates/choice.rs",
      "target": "src/components/ui/choice.rs"
    }
  ],
  "dependencies": [
    "root-state"
  ],
  "assets": []
}
